{
  "$schema": "https://json-schema.org/draft/2020-12/schema",
  "$id": "urn:t3code:agent-app-benchmark:v1:environment",
  "title": "Agent-app benchmark environment disclosure v1",
  "type": "object",
  "properties": {
    "capturedAt": {
      "type": "string",
      "allOf": [
        {
          "pattern": "^\\S[\\s\\S]*\\S$|^\\S$|^$",
          "description": "a string with no leading or trailing whitespace"
        },
        {
          "minLength": 1,
          "description": "a value with a length of at least 1"
        },
        {
          "maxLength": 256,
          "description": "a value with a length of at most 256"
        }
      ]
    },
    "os": {
      "type": "string",
      "allOf": [
        {
          "pattern": "^\\S[\\s\\S]*\\S$|^\\S$|^$",
          "description": "a string with no leading or trailing whitespace"
        },
        {
          "minLength": 1,
          "description": "a value with a length of at least 1"
        },
        {
          "maxLength": 256,
          "description": "a value with a length of at most 256"
        }
      ]
    },
    "architecture": {
      "type": "string",
      "allOf": [
        {
          "pattern": "^\\S[\\s\\S]*\\S$|^\\S$|^$",
          "description": "a string with no leading or trailing whitespace"
        },
        {
          "minLength": 1,
          "description": "a value with a length of at least 1"
        },
        {
          "maxLength": 256,
          "description": "a value with a length of at most 256"
        }
      ]
    },
    "cpuModel": {
      "type": "string",
      "allOf": [
        {
          "pattern": "^\\S[\\s\\S]*\\S$|^\\S$|^$",
          "description": "a string with no leading or trailing whitespace"
        },
        {
          "minLength": 1,
          "description": "a value with a length of at least 1"
        },
        {
          "maxLength": 256,
          "description": "a value with a length of at most 256"
        }
      ]
    },
    "logicalCoreCount": {
      "type": "integer",
      "allOf": [
        {
          "description": "an integer"
        },
        {
          "exclusiveMinimum": 0,
          "description": "a value greater than 0"
        }
      ]
    },
    "physicalMemoryBytes": {
      "type": "integer",
      "allOf": [
        {
          "description": "an integer"
        },
        {
          "exclusiveMinimum": 0,
          "description": "a value greater than 0"
        }
      ]
    },
    "displayRefreshHz": {
      "anyOf": [
        {
          "type": "number",
          "allOf": [
            {
              "description": "a finite number"
            },
            {
              "exclusiveMinimum": 0,
              "description": "a value greater than 0"
            }
          ]
        },
        {
          "type": "string",
          "enum": ["Infinity", "-Infinity", "NaN"]
        }
      ]
    },
    "displayScale": {
      "anyOf": [
        {
          "type": "number",
          "allOf": [
            {
              "description": "a finite number"
            },
            {
              "exclusiveMinimum": 0,
              "description": "a value greater than 0"
            }
          ]
        },
        {
          "type": "string",
          "enum": ["Infinity", "-Infinity", "NaN"]
        }
      ]
    },
    "powerSource": {
      "type": "string",
      "allOf": [
        {
          "pattern": "^\\S[\\s\\S]*\\S$|^\\S$|^$",
          "description": "a string with no leading or trailing whitespace"
        },
        {
          "minLength": 1,
          "description": "a value with a length of at least 1"
        },
        {
          "maxLength": 256,
          "description": "a value with a length of at most 256"
        }
      ]
    },
    "thermalState": {
      "type": "string",
      "allOf": [
        {
          "pattern": "^\\S[\\s\\S]*\\S$|^\\S$|^$",
          "description": "a string with no leading or trailing whitespace"
        },
        {
          "minLength": 1,
          "description": "a value with a length of at least 1"
        },
        {
          "maxLength": 256,
          "description": "a value with a length of at most 256"
        }
      ]
    },
    "window": {
      "type": "object",
      "properties": {
        "width": {
          "type": "integer",
          "allOf": [
            {
              "description": "an integer"
            },
            {
              "exclusiveMinimum": 0,
              "description": "a value greater than 0"
            }
          ]
        },
        "height": {
          "type": "integer",
          "allOf": [
            {
              "description": "an integer"
            },
            {
              "exclusiveMinimum": 0,
              "description": "a value greater than 0"
            }
          ]
        }
      },
      "required": ["width", "height"],
      "additionalProperties": false
    },
    "colorScheme": {
      "type": "string",
      "enum": ["light", "dark"]
    },
    "reducedMotion": {
      "type": "boolean"
    },
    "launchFlags": {
      "type": "array",
      "items": {
        "type": "string"
      }
    }
  },
  "required": [
    "capturedAt",
    "os",
    "architecture",
    "cpuModel",
    "logicalCoreCount",
    "physicalMemoryBytes",
    "displayRefreshHz",
    "displayScale",
    "powerSource",
    "thermalState",
    "window",
    "colorScheme",
    "reducedMotion",
    "launchFlags"
  ],
  "additionalProperties": false,
  "$defs": {}
}
